<?xml version="1.0" encoding="UTF-8"?>
<!DOCTYPE tv SYSTEM "xmltv.dtd">
<tv>
  <programme channel="channel0" start="20010829000500 MST">
    <title>Zed</title>
    <desc>no match as TMDB has no release-date</desc>
  </programme>
  <programme channel="channel0" start="20010829000500 MST">
    <title>Zed</title>
    <desc>no match as TMDB has no release-date</desc>
    <date>2010</date>
  </programme>
</tv>
