<?xml version="1.0" encoding="UTF-8"?>
<!DOCTYPE tv SYSTEM "xmltv.dtd">
<tv>
	
  <programme channel="channel0" start="20010829000500 MST">
    <title>The Matrix</title>
    <desc>standard fetch but no urls</desc>
    <date>1999</date>
  </programme>
  <programme channel="channel0" start="20010829000500 MST">
    <title>The Matrix</title>
    <desc>match - off by one year</desc>
    <date>2000</date>
  </programme>
  <programme channel="channel0" start="20010829000500 MST">
    <title>The Matrix</title>
    <desc>match - off by one year</desc>
    <date>1998</date>
  </programme>
  <programme channel="channel0" start="20010829000500 MST">
    <title>The Matrix</title>
    <desc>match - off by two years</desc>
    <date>1997</date>
  </programme>
  <programme channel="channel0" start="20010829000500 MST">
    <title>The Matrix</title>
    <desc>no match - off by 3 years</desc>
    <date>1996</date>
  </programme>
  
</tv>
