<?xml version="1.0" encoding="UTF-8"?>
<!DOCTYPE tv SYSTEM "xmltv.dtd">
<tv>
  <programme channel="channel0" start="20010829000500 MST">
    <title>The Artist</title>
    <desc>exact match</desc>
    <date>2011</date>
  </programme>
  <programme channel="channel0" start="20010829000500 MST">
    <title>Artist, The</title>
    <desc>exact match - title is corrected</desc>
    <date>2011</date>
  </programme>
  <programme channel="channel0" start="20010829000500 MST">
    <title>Le Corbeau</title>
    <desc>exact match</desc>
    <date>1943</date>
  </programme>
  <programme channel="channel0" start="20010829000500 MST">
    <title>Corbeau, Le</title>
    <desc>exact match - added corrected title</desc>
    <date>1943</date>
  </programme>
</tv>
