<?xml version="1.0" encoding="UTF-8"?>
<!DOCTYPE tv SYSTEM "xmltv.dtd">
<tv>
  <programme channel="channel0" start="20010829000500 MST">
    <title>Gone with the Wind</title>
    <desc>cast names should not be duplicated</desc>
    <credits>
      <director>Victor Fleming</director>
      <actor>Vivien Leigh</actor>
      <actor>Barbara O'Neil</actor>
    </credits>
    <date>1940</date>
  </programme>
</tv>
