<?xml version="1.0" encoding="UTF-8"?>
<!DOCTYPE tv SYSTEM "xmltv.dtd">
<tv>
  <programme channel="channel0" start="20010829000500 MST">
    <title>The Matrix</title>
    <desc>augmented with Director</desc>
    <date>1999</date>
  </programme>
  <programme channel="channel0" start="20010829000500 MST">
    <title>The Tonight Show with Jay Leno</title>
    <desc>no augment - --movies-only</desc>
  </programme>
</tv>
