<?xml version="1.0" encoding="UTF-8"?>
<!DOCTYPE tv SYSTEM "xmltv.dtd">
<tv>
  <programme channel="channel0" start="20010829000500 MST">
    <title>Father Ted: A Christmassy Ted</title>
    <desc>add ratings - movie</desc>
    <date>1996</date>
  </programme>
  <programme channel="channel0" start="20010829000500 MST">
    <title>Father Ted</title>
    <desc>add ratings - tv series</desc>
  </programme>
  <programme channel="channel0" start="20010829000500 MST">
    <title>The Matrix</title>
    <desc>multiple censor classifications</desc>
    <date>1999</date>
  </programme>
</tv>
