<?xml version="1.0" encoding="UTF-8"?>
<!DOCTYPE tv SYSTEM "xmltv.dtd">
<tv>
  <programme channel="channel0" start="20010829000500 MST">
    <title>The King and I</title>
    <desc>correct title</desc>
    <date>1956</date>
  </programme>
  <programme channel="channel0" start="20010829000500 MST">
    <title>The King &amp; I</title>
    <desc>correct title is added</desc>
    <date>1956</date>
  </programme>
</tv>
