<?xml version="1.0" encoding="UTF-8"?>
<!DOCTYPE tv SYSTEM "xmltv.dtd">
<tv>
  <programme channel="channel0" start="20010829000500 MST">
    <title>R.O.T.O.R.</title>
    <desc>dots should be preserved</desc>
    <date>1987</date>
  </programme>
  <programme channel="channel0" start="20010829000500 MST">
    <title>R.O.T.O.R</title>
    <desc>dots should be preserved; one dot missing - should be added</desc>
    <date>1987</date>
  </programme>
  <programme channel="channel0" start="20010829000500 MST">
    <title>T.i.t.a.n.i.c</title>
    <desc>dots are removed from corrected title</desc>
    <date>1997</date>
  </programme>
</tv>
