<?xml version="1.0" encoding="UTF-8"?>
<!DOCTYPE tv SYSTEM "xmltv.dtd">
<tv>
  <programme channel="channel0" start="20010829000500 MST">
    <title>Titanic</title>
    <desc>merge new credits with existing (+ duplicates removed)</desc>
    <credits>
      <actor>Mickey Mouse</actor>
      <actor>Kate Winslet</actor>
    </credits>
    <date>1997</date>
  </programme>
</tv>
