<?xml version="1.0" encoding="UTF-8"?>
<!DOCTYPE tv SYSTEM "xmltv.dtd">
<tv>
  <programme channel="channel0" start="20010829000500 MST">
    <title>Angèle and Tony</title>
    <desc>title has e-grave</desc>
    <date>2011</date>
  </programme>
  <programme channel="channel0" start="20010829000500 MST">
    <title lang="en">Titanic</title>
    <desc>has german director with umlaut - Lutz Büscher</desc>
    <date>1984</date>
  </programme>
</tv>
