<?xml version="1.0" encoding="UTF-8"?>
<!DOCTYPE tv SYSTEM "xmltv.dtd">

<tv generator-info-name="tv_augment">
  <channel id="bbc1.bbc.co.uk">
    <display-name lang="en">BBC1</display-name>
  </channel>
  <programme start="201607011200 +0100" stop="201607011300 +0100" channel="bbc1.bbc.co.uk">
    <title lang="en">Antiques Roadshow</title>
    <desc lang="en">Blah blah blah blah blah.</desc>
    <date>2016</date>
    <category lang="en">Interests</category>
    <video>
      <aspect>16:9</aspect>
    </video>
    <subtitles type="teletext">
      <language lang="en">English</language>
    </subtitles>
  </programme>
  <programme start="201607011300 +0100" stop="201607011400 +0100" channel="bbc1.bbc.co.uk">
    <title lang="en">Deal or No Deal</title>
    <desc lang="en">Blah blah blah blah blah.</desc>
    <date>2016</date>
    <category lang="en">Entertainment</category>
    <video>
      <aspect>16:9</aspect>
    </video>
    <subtitles type="teletext">
      <language lang="en">English</language>
    </subtitles>
  </programme>
  <programme start="201607011400 +0100" stop="201607011500 +0100" channel="bbc1.bbc.co.uk">
    <title lang="en">Men Behaving Badly</title>
    <desc lang="en">Blah blah blah blah blah.</desc>
    <date>2016</date>
    <category lang="en">Entertainment</category>
    <video>
      <aspect>16:9</aspect>
    </video>
    <subtitles type="teletext">
      <language lang="en">English</language>
    </subtitles>
  </programme>
  <programme start="201607011500 +0100" stop="201607011600 +0100" channel="bbc1.bbc.co.uk">
    <title lang="en">Springwatch 2015</title>
    <desc lang="en">Blah blah blah blah blah.</desc>
    <date>2016</date>
    <category lang="en">Entertainment</category>
    <video>
      <aspect>16:9</aspect>
    </video>
    <subtitles type="teletext">
      <language lang="en">English</language>
    </subtitles>
  </programme>
  <programme start="201607011600 +0100" stop="201607011700 +0100" channel="bbc1.bbc.co.uk">
    <title lang="en">Springwatch 2016</title>
    <desc lang="en">Blah blah blah blah blah.</desc>
    <date>2016</date>
    <category lang="en">Entertainment</category>
    <video>
      <aspect>16:9</aspect>
    </video>
    <subtitles type="teletext">
      <language lang="en">English</language>
    </subtitles>
  </programme>
  <programme start="201607011700 +0100" stop="201607011800 +0100" channel="bbc1.bbc.co.uk">
    <title lang="en">M*A*S*H</title>
    <desc lang="en">Blah blah blah blah blah.</desc>
    <date>2016</date>
    <category lang="en">Entertainment</category>
    <video>
      <aspect>16:9</aspect>
    </video>
    <subtitles type="teletext">
      <language lang="en">English</language>
    </subtitles>
  </programme>
  <programme start="201607011800 +0100" stop="201607011900 +0100" channel="bbc1.bbc.co.uk">
    <title lang="en">Mr. Robot</title>
    <desc lang="en">Blah blah blah blah blah.</desc>
    <date>2016</date>
    <category lang="en">Entertainment</category>
    <video>
      <aspect>16:9</aspect>
    </video>
    <subtitles type="teletext">
      <language lang="en">English</language>
    </subtitles>
  </programme>
  <programme start="201607011900 +0100" stop="201607012000 +0100" channel="bbc1.bbc.co.uk">
    <title lang="en">Later... with Jools Holland</title>
    <desc lang="en">Blah blah blah blah blah.</desc>
    <date>2016</date>
    <category lang="en">Entertainment</category>
    <video>
      <aspect>16:9</aspect>
    </video>
    <subtitles type="teletext">
      <language lang="en">English</language>
    </subtitles>
  </programme>
  <programme start="201607012000 +0100" stop="201607012100 +0100" channel="bbc1.bbc.co.uk">
    <title lang="en">Later Live... with Jools Holland</title>
    <desc lang="en">Blah blah blah blah blah.</desc>
    <date>2016</date>
    <category lang="en">Entertainment</category>
    <video>
      <aspect>16:9</aspect>
    </video>
    <subtitles type="teletext">
      <language lang="en">English</language>
    </subtitles>
  </programme>
  <programme start="201607012100 +0100" stop="201607012200 +0100" channel="bbc1.bbc.co.uk">
    <title lang="en">M*A*S*H +1 ?</title>
    <desc lang="en">Blah blah blah blah blah.</desc>
    <date>2016</date>
    <category lang="en">Entertainment</category>
    <video>
      <aspect>16:9</aspect>
    </video>
    <subtitles type="teletext">
      <language lang="en">English</language>
    </subtitles>
  </programme>
</tv>
