<?xml version="1.0" encoding="UTF-8"?>
<!DOCTYPE tv SYSTEM "xmltv.dtd">
<tv>
  <programme channel="channel0" start="20010829000500 MST">
    <title>The IT Crowd</title>
    <desc>no match - has 2 series with same name 2006 and 2007</desc>
  </programme>
  <programme channel="channel0" start="20010829000500 MST">
    <title>The IT Crowd</title>
    <desc>no match - has 2 series with same name 2006 and 2007</desc>
    <date>2006</date>
  </programme>
</tv>

