<?xml version="1.0" encoding="UTF-8"?>
<!DOCTYPE tv SYSTEM "xmltv.dtd">

<tv generator-info-name="tv_augment">
  <channel id="bbc1.bbc.co.uk">
    <display-name lang="en">BBC1</display-name>
  </channel>
  <programme start="201607011200 +0100" stop="201607011300 +0100" channel="bbc1.bbc.co.uk">
    <title lang="en">The Bridge on the River Kwai</title>
    <date>2016</date>
    <category lang="en">Film</category>
    <category lang="en">Adventure/War</category>
    <category lang="en">Drama</category>
    <video>
      <aspect>16:9</aspect>
    </video>
    <subtitles type="teletext">
      <language lang="en">English</language>
    </subtitles>
  </programme>
  <programme start="201607011300 +0100" stop="201607011400 +0100" channel="bbc1.bbc.co.uk">
    <title lang="en">NFL Live</title>
    <sub-title lang="en">Miami Dolphins vs Seattle Seahawks</sub-title>
    <date>2016</date>
    <category lang="en">NFL</category>
    <category lang="en">Sport</category>
    <video>
      <aspect>16:9</aspect>
    </video>
    <subtitles type="teletext">
      <language lang="en">English</language>
    </subtitles>
  </programme>
  <programme start="201607011400 +0100" stop="201607011500 +0100" channel="bbc1.bbc.co.uk">
    <title lang="en">MOTD Live</title>
    <sub-title lang="en">Liverpool vs Manchester United</sub-title>
    <date>2016</date>
    <category lang="en">Sport</category>
    <category lang="en">Soccer</category>
    <video>
      <aspect>16:9</aspect>
    </video>
    <subtitles type="teletext">
      <language lang="en">English</language>
    </subtitles>
  </programme>
</tv>
