<?xml version="1.0" encoding="UTF-8"?>
<!DOCTYPE tv SYSTEM "xmltv.dtd">
<tv>
  <programme channel="channel0" start="20010829000500 MST">
    <title>M*A*S*H</title>
    <desc>exact match on tv series</desc>
  </programme>
  <programme channel="channel0" start="20010829000500 MST">
    <title>#RealMovie</title>
    <desc>exact match on movie</desc>
    <date>2013</date>
  </programme>
</tv>
