<?xml version="1.0" encoding="UTF-8"?>
<!DOCTYPE tv SYSTEM "xmltv.dtd">
<tv>
  <programme channel="channel0" start="20010829000500 MST">
    <title>Angèle and Tony</title>
    <desc>title has e-grave</desc>
    <date>2011</date>
  </programme>
  <programme channel="channel0" start="20010829000500 MST">
    <title>Amélie</title>
    <desc>title has e-acute</desc>
    <date>2001</date>
  </programme>
  <programme channel="channel0" start="20010829000500 MST">
    <title>Mädchen in Uniform</title>
    <desc>title has a-umlaut</desc>
    <date>1931</date>
  </programme>
</tv>
