<?xml version="1.0" encoding="UTF-8"?>
<!DOCTYPE tv SYSTEM "xmltv.dtd">
<tv>
  <programme channel="channel0" start="20010829000500 MST">
    <title>The Invisible Man (1933)</title>
    <desc>exact match on movie - year removed from title</desc>
  </programme>  
  
  <programme start="20211004090500 +0100" stop="20211004112500 +0100" channel="1691">
    <title lang="en">Foxcatcher</title>
    <desc>exact match </desc>
    <date>2014</date>
    <category lang="en">Films</category>
  </programme>
  
  <programme start="20211004090500 +0100" stop="20211004112500 +0100" channel="1691">
    <title lang="en">Foxcatcher (2014)</title>
    <desc>also exact match </desc>
    <category lang="en">Films</category>
  </programme>
  
  <programme start="20211004090500 +0100" stop="20211004112500 +0100" channel="1691">
    <title lang="en">Foxcatcher (2014)</title>
    <desc>matches using date from title (which is then stripped in output)</desc>
    <category lang="en">Films</category>
  </programme>
  
  <programme start="20211004090500 +0100" stop="20211004112500 +0100" channel="1691">
    <title lang="en">Foxcatcher (2013)</title>
    <desc>matches on a close hit</desc>
    <category lang="en">Films</category>
  </programme>
  
  <programme start="20211004090500 +0100" stop="20211004112500 +0100" channel="1691">
    <title lang="en">Foxcatcher (2000)</title>
    <desc>neither exact or close match (off by 14 years)</desc>
    <category lang="en">Films</category>
  </programme>
  
</tv>
