<?xml version="1.0" encoding="UTF-8"?>
<!DOCTYPE tv SYSTEM "xmltv.dtd">
<tv>
  <programme channel="channel0" start="20010829000500 MST">
    <title>Angèle and Tony</title>
    <desc>exact match</desc>
    <date>2011</date>
  </programme>
  <programme channel="channel0" start="20010829000500 MST">
    <title>Angèle et Tony</title>
    <desc>exact match on alternative title</desc>
    <date>2011</date>
  </programme>
</tv>
